{
  "$schema": "http://json-schema.org/draft-07/schema#",
  "$id": "uefn.handoff.Sound_Designer.v1",
  "title": "Sound_Designer - contrat du livrable 13_sfx.json",
  "description": "Schema de sortie de l'agent Sound_Designer (agent 19, pole Audio, phase POLISH). Enveloppe = uefn.handoff.v1 (util/multi_agent/04-contrat-handoff.md) ; le payload porte la LISTE DES EVENEMENTS SONORES, une source, un declencheur, une forme spectrale, une portee, des variantes. Pas le mix ni la cartographie (17), pas la musique (18), pas les voix (20), pas l'implementation (12/14). Agent de conception audio : acces_mcp = none, donc aucun tool-output attendu, pas d'outils.md, aucune coordonnee, aucun PID_/PPID_ final impose, aucun device audio decrete. Chaque champ est cochable par un validateur Python : les valeurs numeriques portent un statut de preuve (WP2 p.9), un SFX d'etat exige un evenement reellement expose, et le contrat ne peut pas revendiquer d'avoir entendu quoi que ce soit en session.",
  "type": "object",
  "additionalProperties": false,
  "required": [
    "$schema",
    "handoff_id",
    "from",
    "to",
    "artifact",
    "mission_ref",
    "summary_short",
    "payload",
    "constraints",
    "acceptance",
    "next_step_hint",
    "context_budget_tokens"
  ],
  "properties": {
    "$schema": { "const": "uefn.handoff.v1" },
    "handoff_id": { "type": "string", "pattern": "^H-[A-Z]+-[0-9]{3,}$" },
    "from": { "const": "Sound_Designer" },
    "to": {
      "type": "array",
      "minItems": 1,
      "items": {
        "enum": [
          "Producer_Orchestrator",
          "Creative_Director",
          "Game_Designer",
          "System_Designer",
          "Economy_Designer",
          "Mission_Content_Designer",
          "Narrative_Designer",
          "Writer_Scenariste",
          "UX_UI_Designer",
          "Level_Designer",
          "Engine_Programmer",
          "Lead_Programmer",
          "Gameplay_Programmer",
          "AI_Programmer",
          "UI_Programmer",
          "Graphics_Programmer",
          "Physics_Programmer",
          "Audio_Director",
          "Composer",
          "Sound_Designer",
          "Voice_Designer"
        ]
      }
    },
    "artifact": { "const": "13_sfx.json" },
    "mission_ref": { "type": "string", "minLength": 1 },
    "summary_short": { "type": "string", "minLength": 1, "maxLength": 200 },
    "payload": {
      "type": "object",
      "additionalProperties": false,
      "required": [
        "direction_recue",
        "evenements",
        "valeurs_quantitatives",
        "abstentions",
        "support_lecture"
      ],
      "properties": {
        "direction_recue": {
          "type": "object",
          "additionalProperties": false,
          "required": [
            "artefat_amont",
            "statut_amont",
            "identite_sonore_de",
            "perimetre_cadrage"
          ],
          "description": "L'input amont, declare avec son statut reel. 13_audio_direction.json (agent 17) est l'artefat attendu ; payload.identite_sonore de 00_vision.json (agent 01) en est la source creative.",
          "properties": {
            "artefat_amont": { "type": "string", "minLength": 3 },
            "statut_amont": {
              "enum": ["recu", "partiel", "absent", "UNKNOWN"],
              "description": "absent = le handoff amont n'existe pas sur le bus. La liste se construit alors sur les seuls artefacts reels du run, et le trou est declare, pas comble par une hypothese."
            },
            "identite_sonore_de": { "type": "string", "minLength": 3 },
            "perimetre_cadrage": {
              "type": "string",
              "minLength": 10,
              "description": "La contrainte de scene qui borne mes evenements, avec sa reference (decision utilisateur, section du journal, note de 01_gdd.json)."
            },
            "interdits_recus": {
              "type": "array",
              "items": { "type": "string", "minLength": 4 }
            },
            "ecart_de_sources": { "type": "string" }
          }
        },
        "evenements": {
          "type": "array",
          "minItems": 0,
          "maxItems": 40,
          "items": { "$ref": "#/definitions/evenement" },
          "description": "Tableau des evenements sonores. Vide est legal UNIQUEMENT si abstentions explique pourquoi rien n'est requetable ; au-dela de 40 entrees, le budget runtime et l'attention du mixeur sont depasses."
        },
        "valeurs_quantitatives": {
          "type": "array",
          "minItems": 1,
          "items": { "$ref": "#/definitions/quantite" },
          "description": "Durees, niveaux, portees, loops : tout nombre sort d'ici avec son statut de preuve. Jamais un chiffre calcule de tete par le modele (WP2 p.9), jamais un niveau presente comme mesure quand aucune session n'a ete connectee."
        },
        "abstentions": {
          "type": "array",
          "minItems": 1,
          "items": { "$ref": "#/definitions/abstention" },
          "description": "Ce que je ne livre pas et pourquoi, categorie par categorie. Sur une scene sans mecanique ce n'est pas un appendice : c'est la moitie du livrable."
        },
        "support_lecture": {
          "type": "object",
          "additionalProperties": false,
          "required": ["statut", "raison", "commande_verification", "consequence"],
          "description": "Honnetete sur l'ecoute. Ce contrat ne connait pas de statut 'ecoute_en_session' : le revendiquer sans session connectee est un motif de rejet.",
          "properties": {
            "statut": {
              "enum": ["jamais_ecoute", "ecoute_hors_jeu", "UNKNOWN"],
              "description": "jamais_ecoute = rien de ce qui est decrit ici n'a ete entendu dans le jeu. ecoute_hors_jeu = ecoute de materiaux hors moteur, ce qui ne prouve rien en session."
            },
            "raison": { "type": "string", "minLength": 10 },
            "commande_verification": {
              "type": "string",
              "minLength": 6,
              "description": "Commande ou chemin d'artefact qui permet a un juge externe de cocher le statut (grep du journal, lecture de 09_verse_report.json)."
            },
            "consequence": { "type": "string", "minLength": 6 }
          }
        }
      }
    },
    "constraints": {
      "type": "object",
      "additionalProperties": true,
      "required": ["acces_mcp", "must_preserve", "forbidden"],
      "properties": {
        "acces_mcp": {
          "const": "none",
          "description": "Pole Audio, agent de conception : aucun appel MCP, aucune ecriture dans l'editeur, pas d'outils.md dans ce paquet."
        },
        "must_preserve": {
          "type": "array",
          "minItems": 1,
          "items": { "type": "string" },
          "description": "Garde-fous transmis en aval (Audio_Director pour le mix, 12/14 pour les retours d'evenement)."
        },
        "forbidden": { "type": "array", "minItems": 1, "items": { "type": "string" } },
        "must_ask_producer": {
          "type": "array",
          "items": { "type": "string" },
          "description": "Questions remontees au Producteur, jamais posees a l'utilisateur en direct (15 max par phase)."
        },
        "preuves_manquantes": {
          "type": "array",
          "items": { "type": "string" },
          "description": "Ce qui aurait du exister pour justifier un SFX et n'existe pas (13_audio_direction.json, 01_systems.json, session connectee)."
        },
        "gate_hitl_attendu": {
          "type": "object",
          "additionalProperties": false,
          "required": ["numero", "statut"],
          "description": "Un agent n'ecrit que PENDING dans un champ de gate : la validation est humaine, portee par le Producteur.",
          "properties": {
            "numero": { "type": "integer", "minimum": 1, "maximum": 4 },
            "statut": { "const": "PENDING" },
            "motif": { "type": "string", "minLength": 6 }
          }
        }
      }
    },
    "golden_example_ref": { "type": "string" },
    "exemple_annotations": {
      "type": "object",
      "additionalProperties": true,
      "description": "Cle reservee aux fichiers de skill/exemples/ (commentaire pedagogique : pourquoi cet exemple passe ou echoue). Elle ne doit jamais apparaitre dans un handoff reel."
    },
    "acceptance": {
      "type": "array",
      "minItems": 4,
      "items": {
        "enum": [
          "event_source_prouvee_ou_unknown",
          "quantite_avec_statut_de_preuve",
          "no_sfx_etat_sans_evenement_expose",
          "no_sfx_contre_scene_sans_mecanique",
          "no_coordinate_rattachement",
          "support_lecture_declared",
          "no_session_listen_claim",
          "abstentions_motivees",
          "amont_audio_direction_declare",
          "no_final_pid_or_ppid_imposed",
          "no_mcp_write_claim_in_constraints"
        ]
      }
    },
    "next_step_hint": { "type": "string", "maxLength": 400 },
    "context_budget_tokens": { "type": "integer", "maximum": 4000 }
  },
  "definitions": {
    "evenement": {
      "type": "object",
      "additionalProperties": false,
      "required": [
        "id",
        "nom",
        "source",
        "declencheur",
        "rattachement",
        "forme",
        "portee",
        "variantes",
        "statut",
        "motif_rattachement"
      ],
      "properties": {
        "id": { "type": "string", "pattern": "^SFX-[0-9]{2,3}$" },
        "nom": { "type": "string", "pattern": "^[a-z0-9_]{6,60}$" },
        "source": { "$ref": "#/definitions/source" },
        "declencheur": {
          "enum": [
            "ambiance_continue",
            "apparition_joueur",
            "visibilite_bassin",
            "circulation_libre",
            "presence_objet",
            "signal_etat_jeu"
          ],
          "description": "Les seuls cas reels de ce pipeline : les trois premiers temps de gameplay_timeline_sec de 01_gdd.json (0 s apparition au sud, 1 s bassin et deux poissons visibles, 5 s circulation libre), la presence d'un objet pose, la boucle d'ambiance. 'signal_etat_jeu' est le seul declencheur conditionnel et il est verrouille par signal_etat_jeu."
        },
        "rattachement": { "$ref": "#/definitions/rattachement" },
        "forme": { "$ref": "#/definitions/forme" },
        "portee": { "$ref": "#/definitions/portee" },
        "variantes": { "$ref": "#/definitions/variantes" },
        "statut": {
          "enum": ["NON_POSE", "A_VERIFIER", "UNKNOWN"],
          "description": "NON_POSE = congu, aucun asset audio cherche ni pose dans le run (cas normal ici : 49 requetes catalogue, 0 audio). A_VERIFIER = congu et rattache, mais une hypothese reste a controler a l'ecoute. UNKNOWN = le rattachement ou la source n'est pas etabli."
        },
        "motif_rattachement": {
          "type": "string",
          "minLength": 10,
          "maxLength": 220,
          "description": "Pourquoi CE son sort de CET objet : la phrase qui rend l'entree falsifiable."
        },
        "intention_emotionnelle": { "type": "string", "minLength": 4 },
        "signal_etat_jeu": { "$ref": "#/definitions/signal_etat_jeu" }
      },
      "if": {
        "properties": { "declencheur": { "const": "signal_etat_jeu" } },
        "required": ["declencheur"]
      },
      "then": { "required": ["signal_etat_jeu"] }
    },
    "source": {
      "type": "object",
      "additionalProperties": false,
      "required": ["objet", "artefat_prouve", "statut_ref"],
      "description": "Un evenement sonore sans objet reellement pose n'existe pas.",
      "properties": {
        "objet": {
          "type": "string",
          "minLength": 4,
          "description": "L'objet reel du decor qui emet : bassin central vitre, enseigne poisson neon, anneau concentrique, dalle du plateau, lampadaire, tour dominante."
        },
        "artefat_prouve": {
          "enum": [
            "01_gdd.json",
            "02_palette.json",
            "03_grid.json",
            "04_devices.json",
            "05_props.json",
            "06_audit_report.json",
            "06_navigation_report.json",
            "07_properties_report.json",
            "09_verse_report.json",
            "10_editables.json",
            "UNKNOWN"
          ],
          "description": "L'artefat de la chaine qui prouve que l'objet existe. Une cle hors de cette liste est une source inventee : rejet."
        },
        "statut_ref": {
          "enum": ["present", "absent", "UNKNOWN"],
          "description": "present = l'objet figure dans l'artefat cite. absent = aucune trace : le SFX doit passer en statut UNKNOWN ou disparaitre."
        },
        "precision": { "type": "string" }
      }
    },
    "rattachement": {
      "type": "object",
      "additionalProperties": false,
      "required": ["type", "valeur"],
      "description": "Un zone_id de 01_gdd.json ou un actor_label existant de 04_devices.json. Jamais de x/y/z.",
      "properties": {
        "type": { "enum": ["zone_id", "actor_label"] },
        "valeur": {
          "type": "string",
          "pattern": "^[A-Za-z][A-Za-z0-9_]{2,60}$",
          "description": "Le pattern refuse chiffres en tete, separateurs et listes : [1200, 0, 384] ou '3389.81;6897.64' sont impossibles ici."
        }
      }
    },
    "forme": {
      "type": "object",
      "additionalProperties": false,
      "required": ["bande", "enveloppe", "contenu"],
      "description": "La forme, pas le fichier : ce que le Sound_Designer prescrit et ce que l'Audio_Director (17) dosera.",
      "properties": {
        "bande": {
          "enum": ["tres_basse", "basse", "mediane", "haute", "tres_haute", "large"]
        },
        "enveloppe": {
          "enum": [
            "tres_lente",
            "lente",
            "franche",
            "soutenu",
            "pulse_unique"
          ]
        },
        "contenu": {
          "enum": [
            "bruit_filtre",
            "tonal_pur",
            "harmonique",
            "transitoire",
            "silence",
            "couches"
          ]
        },
        "description": { "type": "string", "minLength": 8, "maxLength": 160 }
      }
    },
    "portee": {
      "type": "object",
      "additionalProperties": false,
      "required": ["type", "echelle"],
      "properties": {
        "type": {
          "enum": ["ponctuelle", "zone", "directionnelle", "globale"]
        },
        "echelle": {
          "type": "string",
          "minLength": 6,
          "description": "Portee exprimee en reference a un objet ou une zone reels ('depuis le spawner sud jusquau premier anneau'), jamais en metres calcules de tete. Tout nombre absolu releve de valeurs_quantitatives avec statut de preuve."
        }
      }
    },
    "variantes": {
      "type": "object",
      "additionalProperties": false,
      "required": ["nombre", "rotation", "support"],
      "properties": {
        "nombre": { "type": "integer", "minimum": 1, "maximum": 5 },
        "rotation": { "type": "string", "minLength": 8 },
        "support": {
          "enum": ["verifie", "non_verifie", "UNKNOWN"],
          "description": "La rotation de variantes est-elle reellement disponible sur ce run ? non_verifie tant qu'aucun module Verse n'existe (custom_verse_modules = 0 dans 09_verse_report.json)."
        }
      }
    },
    "signal_etat_jeu": {
      "type": "object",
      "additionalProperties": false,
      "required": ["etat_ref", "artefat_etat", "evenement_expose", "statut_imposition"],
      "description": "REGLE VERIFIABLE. Un SFX qui signale un etat du jeu (degats, objectif atteint, chronometre, recompense) n'est livrable que si (a) l'etat existe dans 01_systems.json ou 01_missions.json ET (b) l'evenement est expose dans 09_verse_report.json ou 10_editables.json. Les deux conditions sont cochables par du code ; si l'une manque, statut_imposition = NON_IMPOSEE, et ce n'est pas une decision de gout.",
      "properties": {
        "etat_ref": { "type": "string", "minLength": 3 },
        "artefat_etat": {
          "enum": ["01_systems.json", "01_missions.json", "UNKNOWN"],
          "description": "L'artefat OU l'etat devrait exister. UNKNOWN = aucun des deux n'a ete emis sur ce run : la condition (a) est echouee."
        },
        "evenement_expose": {
          "type": "string",
          "minLength": 3,
          "description": "Nom de l'evenement tel que livre par un rapport reel, ou la valeur explicite 'AUCUN'. AUCUN clot la question : rien a signaler."
        },
        "statut_imposition": {
          "enum": ["IMPOSEE", "NON_IMPOSEE", "UNKNOWN"],
          "description": "IMPOSEE exige artefat_etat != UNKNOWN ET evenement_expose != 'AUCUN'. Sur un run ou custom_verse_modules = 0 et 10_editables.json = NO_VERSE_STAGED avec editable_count = 0, tout SFX d'etat est NON_IMPOSEE par construction."
        }
      }
    },
    "quantite": {
      "type": "object",
      "additionalProperties": false,
      "required": ["grandeur", "valeur", "unite", "statut", "preuve"],
      "properties": {
        "grandeur": { "type": "string", "minLength": 3 },
        "valeur": {
          "type": ["number", "string"],
          "description": "Nombre, ou la chaine 'UNKNOWN' quand aucune mesure n'existe."
        },
        "unite": { "type": "string", "minLength": 1, "maxLength": 12 },
        "statut": {
          "enum": ["mesure", "reserve", "UNKNOWN"],
          "description": "mesure = valeur lue dans un artefact ou une sortie d'outil (alors valeur doit etre un nombre et artefat_mesure est obligatoire). reserve = ordre de grandeur de conception, explicite comme telle, a confirmer a l'ecoute ou au Python. UNKNOWN = aucune donnee."
        },
        "preuve": {
          "type": "string",
          "minLength": 6,
          "maxLength": 200,
          "description": "Ce qui permettrait a un juge de cocher : nom d'artefact, commande, ou 'session play-in-client jamais connectee (journal section 20)'."
        },
        "artefat_mesure": { "type": "string", "minLength": 3 }
      },
      "if": {
        "properties": { "statut": { "const": "mesure" } },
        "required": ["statut"]
      },
      "then": {
        "required": ["artefat_mesure"],
        "properties": { "valeur": { "type": "number" } }
      }
    },
    "abstention": {
      "type": "object",
      "additionalProperties": false,
      "required": ["categorie", "motif", "verifie_dans"],
      "properties": {
        "categorie": {
          "enum": [
            "combat",
            "recompense",
            "economie",
            "quete",
            "ui",
            "pnj",
            "evenement_de_mission",
            "timer",
            "musique",
            "voix",
            "autre"
          ]
        },
        "motif": { "type": "string", "minLength": 10, "maxLength": 220 },
        "verifie_dans": {
          "type": "string",
          "minLength": 3,
          "description": "L'artefat, le champ de config ou la section du journal qui prouve l'absence. 'UNKNOWN' est admis quand aucune recherche n'a ete menee, et doit alors etre dit tel quel."
        },
        "ressource_utile_pour": { "type": "string" }
      }
    }
  }
}
